{
  "contract_version": "aether-enterprise-config.v1",
  "scenario_id": "enterprise-logistics-delivery-exception",
  "title": "Logistics failed delivery and remediation",
  "description": "A fictional delivery consumes capacity, fails, is remediated, and completes with financial consequences.",
  "archetype": "logistics",
  "journey": "delivery-exception",
  "seed": 52004,
  "scale": 2,
  "options": {
    "allow_backorders": false,
    "outcome": "failed-then-remediated",
    "failure_mode": "delayed-work"
  },
  "limitations": [
    "Routes and delivery windows are abstract deterministic states."
  ]
}
