{
  "contract_version": "aether-enterprise-config.v1",
  "scenario_id": "enterprise-saas-outage-remediation",
  "title": "SaaS misconfiguration, outage, and remediation",
  "description": "A fictional configuration error causes an outage that is detected, remediated, and restored.",
  "archetype": "saas",
  "journey": "outage-remediation",
  "seed": 52007,
  "scale": 2,
  "options": {
    "allow_backorders": false,
    "outcome": "failed-then-remediated",
    "failure_mode": "misconfiguration"
  },
  "limitations": [
    "The incident is a synthetic operational research sequence."
  ]
}
