{
  "contract_version": "aether-enterprise-config.v1",
  "scenario_id": "enterprise-professional-services-engagement",
  "title": "Professional services lead to collection",
  "description": "A fictional engagement progresses from lead qualification through delivery, invoicing, and collection.",
  "archetype": "professional-services",
  "journey": "customer-engagement",
  "seed": 52001,
  "scale": 2,
  "options": {
    "allow_backorders": false,
    "outcome": "complete",
    "failure_mode": "none"
  },
  "limitations": [
    "Delivery work is intentionally simplified and not a calibrated services benchmark."
  ]
}
